{
 "schema_version": 1,
 "deck_id": "Garza_Zol__Plague_Queen",
 "slug": "garza-zol-plague-queen",
 "generated_by": "scripts/grixis_evidence.py v1",
 "cycle": 57,
 "date": "2026-10-16",
 "edhrec": {
  "pages": [
   {
    "page": "garza-zol-plague-queen",
    "sha256": "sha256:f77edad1cddb8862f1cf4624061d16e54994639f624d24b93056bcad0fdac768",
    "retrieved": "2026-10-16",
    "newest_deck_save": "2026-10-14"
   }
  ],
  "method": "single_page",
  "class": "derived_metric",
  "columns": [
   "lift",
   "synergy",
   "inclusion",
   "num_decks",
   "potential_decks",
   "trend_zscore",
   "confidence",
   "flags"
  ],
  "note": "EDHREC is community data (derived_metric): it informs, it never decides (decision_support_ok)."
 },
 "snapshot": {
  "id": "sha256:151e2136940af943f5e52fe21085e739213c9a3c8c8fbccb3f686f605d290909",
  "inputs": {
   ".cache/edhrec/commanders__garza-zol-plague-queen.json": "sha256:f77edad1cddb8862f1cf4624061d16e54994639f624d24b93056bcad0fdac768",
   "data/grixis_combos.json": "sha256:3c8fc18c4c79d1e16db9e4c451ce215f118ee842a5ab3276ec44e3a59672f983",
   "data/grixis_interactions/garza-zol-plague-queen.json": "sha256:592d3d080042e464e9df4d513efa41b7870aaee8802e398fac72b34f7501c00f",
   "data/grixis/blueprints/garza-zol-plague-queen.json": "sha256:ef9f049ef7a7440fbc6d27df44bd0fb6244d1bf42ff67a77aca47bc04519da33",
   "grixis/decks/garza-zol-plague-queen.md": "sha256:140aec0ed1e4b15b473977e8f7ac29790b3b7a0609426d9ff600c597dcc1642f",
   "scripts/grixis_evidence.py": "sha256:e90834a722311b4f9dfc5a060dae1116e4a8e07f1d3d8e50b49a73729ffd82ec",
   "oracle_bulk": "oracle-cards-20261016090200.jsonl.gz"
  }
 },
 "counts": {
  "incumbent": 99,
  "candidate": 217,
  "with_edhrec": 276
 },
 "vectors": [
  {"card":"Aggravated Assault","status":"incumbent","zone":"main","edhrec":null,"oracle_hook":{"label":"combat damage / attack triggers","commander":"Garza Zol, Plague Queen","class":"heuristic","confidence":"moderate"},"graph":{"spellbook":{"ids":["3750-5039","900-3750"],"class":"fact","confidence":"verified"},"m1":{"ids":["garza-09"],"class":"fact","confidence":"verified","flags":[]}}},
  {"card":"An Offer You Can't Refuse","status":"incumbent","zone":"main","edhrec":[0.458,-0.17396,0.14729,19,129,0.0,"low",["small_sample"]]},
  {"card":"Ancient Tomb","status":"incumbent","zone":"main","edhrec":null,"graph":{"blueprint":{"packages":["pkg:fast-mana"],"identity_core":false,"version":1,"class":"strategic_judgment","confidence":"moderate"}}},
  {"card":"Arcane Signet","status":"incumbent","zone":"main","edhrec":[0.773,-0.20009,0.68217,88,129,0.0,"moderate",[]],"graph":{"blueprint":{"packages":["pkg:fast-mana"],"identity_core":false,"version":1,"class":"strategic_judgment","confidence":"moderate"}}},
  {"card":"Arid Mesa","status":"incumbent","zone":"main","edhrec":null},
  {"card":"Badlands","status":"incumbent","zone":"main","edhrec":[0.802,-0.0307,0.12403,16,129,0.0,"low",["small_sample"]]},
  {"card":"Basilisk Collar","status":"incumbent","zone":"main","edhrec":[13.692,0.2515,0.27132,35,129,0.0,"moderate",[]],"graph":{"m1":{"ids":["garza-02","garza-03"],"class":"fact","confidence":"verified","flags":[]},"blueprint":{"packages":["pkg:deathtouch-damage"],"identity_core":true,"version":1,"class":"strategic_judgment","confidence":"high"}}},
  {"card":"Blackblade Reforged","status":"incumbent","zone":"main","edhrec":null},
  {"card":"Blade of the Bloodchief","status":"incumbent","zone":"main","edhrec":[152.938,0.33115,0.33333,43,129,0.0,"moderate",[]],"oracle_hook":{"label":"+1/+1 counters","commander":"Garza Zol, Plague Queen","class":"heuristic","confidence":"moderate"},"graph":{"m1":{"ids":["garza-03"],"class":"fact","confidence":"verified","flags":[]}}},
  {"card":"Blood Crypt","status":"incumbent","zone":"main","edhrec":[0.91,-0.04241,0.42636,55,129,0.0,"moderate",[]]},
  {"card":"Bloodstained Mire","status":"incumbent","zone":"main","edhrec":[0.899,-0.03572,0.31783,41,129,0.0,"moderate",[]]},
  {"card":"Bojuka Bog","status":"incumbent","zone":"main","edhrec":[1.197,0.04723,0.28682,37,129,0.0,"moderate",[]]},
  {"card":"Brotherhood Regalia","status":"incumbent","zone":"main","edhrec":null,"oracle_hook":{"label":"combat damage / attack triggers","commander":"Garza Zol, Plague Queen","class":"heuristic","confidence":"moderate"},"graph":{"blueprint":{"packages":["pkg:evasion-protection"],"identity_core":false,"version":1,"class":"strategic_judgment","confidence":"moderate"}}},
  {"card":"Cavern of Souls","status":"incumbent","zone":"main","edhrec":null},
  {"card":"Chandra's Ignition","status":"incumbent","zone":"main","edhrec":[10.535,0.28065,0.31008,40,129,0.0,"moderate",[]],"graph":{"m1":{"ids":["garza-03"],"class":"fact","confidence":"verified","flags":[]},"blueprint":{"packages":["pkg:deathtouch-damage"],"identity_core":true,"version":1,"class":"strategic_judgment","confidence":"high"}}},
  {"card":"Chaos Warp","status":"incumbent","zone":"main","edhrec":[0.648,-0.12227,0.22481,29,129,0.0,"moderate",[]]},
  {"card":"City of Brass","status":"incumbent","zone":"main","edhrec":null},
  {"card":"Command Beacon","status":"incumbent","zone":"main","edhrec":null,"graph":{"m1":{"ids":["garza-08"],"class":"fact","confidence":"high","flags":["garza-08"]},"blueprint":{"packages":["pkg:fast-mana"],"identity_core":false,"version":1,"class":"strategic_judgment","confidence":"moderate"}}},
  {"card":"Command Tower","status":"incumbent","zone":"main","edhrec":[0.845,-0.14227,0.77519,100,129,0.0,"moderate",[]]},
  {"card":"Commander's Plate","status":"incumbent","zone":"main","edhrec":null,"graph":{"blueprint":{"packages":["pkg:evasion-protection"],"identity_core":false,"version":1,"class":"strategic_judgment","confidence":"moderate"}}},
  {"card":"Counterspell","status":"incumbent","zone":"main","edhrec":[0.884,-0.05182,0.39535,51,129,0.0,"moderate",[]]},
  {"card":"Curiosity","status":"incumbent","zone":"main","edhrec":[2.645,0.0675,0.10853,14,129,0.0,"low",["small_sample"]],"graph":{"m1":{"ids":["garza-03","garza-10"],"class":"fact","confidence":"verified","flags":[]}}},
  {"card":"Cyclonic Rift","status":"incumbent","zone":"main","edhrec":[0.353,-0.12791,0.06977,9,129,0.0,"low",["small_sample"]]},
  {"card":"Deadly Rollick","status":"incumbent","zone":"main","edhrec":null},
  {"card":"Deflecting Swat","status":"incumbent","zone":"main","edhrec":null,"graph":{"blueprint":{"packages":["pkg:evasion-protection"],"identity_core":false,"version":1,"class":"strategic_judgment","confidence":"moderate"}}},
  {"card":"Demonic Tutor","status":"incumbent","zone":"main","edhrec":[0.64,-0.07427,0.13178,17,129,0.0,"low",["small_sample"]]},
  {"card":"Dimir Signet","status":"incumbent","zone":"main","edhrec":[1.302,0.09878,0.42636,55,129,0.0,"moderate",[]]},
  {"card":"Exotic Orchard","status":"incumbent","zone":"main","edhrec":[0.732,-0.15299,0.4186,54,129,0.0,"moderate",[]]},
  {"card":"Fall of the Hammer","status":"incumbent","zone":"main","edhrec":[380.905,0.20102,0.20155,26,129,0.0,"moderate",[]],"graph":{"blueprint":{"packages":["pkg:deathtouch-damage"],"identity_core":false,"version":1,"class":"strategic_judgment","confidence":"moderate"}}},
  {"card":"Feed the Swarm","status":"incumbent","zone":"main","edhrec":[1.079,0.02156,0.29457,38,129,0.0,"moderate",[]]},
  {"card":"Fellwar Stone","status":"incumbent","zone":"main","edhrec":[1.02,0.0072,0.36434,47,129,0.0,"moderate",[]],"graph":{"blueprint":{"packages":["pkg:fast-mana"],"identity_core":false,"version":1,"class":"strategic_judgment","confidence":"moderate"}}},
  {"card":"Fierce Guardianship","status":"incumbent","zone":"main","edhrec":null,"graph":{"blueprint":{"packages":["pkg:evasion-protection"],"identity_core":false,"version":1,"class":"strategic_judgment","confidence":"moderate"}}},
  {"card":"Flooded Strand","status":"incumbent","zone":"main","edhrec":null},
  {"card":"Garza Zol, Plague Queen","status":"commander","edhrec":null,"graph":{"m1":{"ids":["garza-01","garza-02","garza-03","garza-04","garza-05","garza-06","garza-07","garza-08","garza-09","garza-10","garza-11"],"class":"fact","confidence":"high","flags":["garza-08"]},"blueprint":{"packages":[],"identity_core":true,"version":1,"class":"strategic_judgment","confidence":"high"}}},
  {"card":"Grafted Exoskeleton","status":"incumbent","zone":"main","edhrec":null,"graph":{"spellbook":{"ids":["2822-3681"],"class":"fact","confidence":"verified"},"m1":{"ids":["garza-05","garza-06"],"class":"fact","confidence":"verified","flags":[]}}},
  {"card":"Grim Monolith","status":"incumbent","zone":"main","edhrec":null,"graph":{"blueprint":{"packages":["pkg:fast-mana"],"identity_core":false,"version":1,"class":"strategic_judgment","confidence":"moderate"}}},
  {"card":"Hatred","status":"incumbent","zone":"main","edhrec":null,"graph":{"m1":{"ids":["garza-07"],"class":"fact","confidence":"verified","flags":[]}}},
  {"card":"Inquisitor's Flail","status":"incumbent","zone":"main","edhrec":null,"graph":{"m1":{"ids":["garza-07"],"class":"fact","confidence":"verified","flags":[]}}},
  {"card":"Island","status":"incumbent","zone":"main","edhrec":[0.975,-0.02363,0.90698,117,129,0.0,"moderate",[]]},
  {"card":"Izzet Signet","status":"incumbent","zone":"main","edhrec":[1.339,0.10405,0.41085,53,129,0.0,"moderate",[]]},
  {"card":"Jeska's Will","status":"incumbent","zone":"main","edhrec":null},
  {"card":"Jeska, Thrice Reborn","status":"incumbent","zone":"main","edhrec":null,"graph":{"m1":{"ids":["garza-07","garza-08"],"class":"fact","confidence":"high","flags":["garza-08"]}}},